"pubDate","timestamp","title","description","link","rss-url","country","category"
"2022-10-30 12:11:00+05:30","1667112060.0","Children aged 8 or younger face higher risk of monkeypox: Researchers","Children aged 8 years or younger should be considered a group at high risk for more severe monkeypox disease, researchers report.","https://www.business-standard.com/article/current-affairs/children-aged-8-or-younger-face-higher-risk-of-monkeypox-researchers-122103000242_1.html","http://www.business-standard.com/rss/current-affairs-news-11501.rss","IN","general"
"2022-10-30 11:47:00+05:30","1667110620.0","300-year-old system of naming bacteria revised on scientific advances","A new way to name bacteria: 300-year-old system revised thanks to scientific advances","https://www.business-standard.com/article/current-affairs/300-year-old-system-of-naming-bacteria-revised-on-scientific-advances-122103000248_1.html","http://www.business-standard.com/rss/current-affairs-news-11501.rss","IN","general"
"2022-10-30 11:43:00+05:30","1667110380.0","Karnataka HC quashes land acquisition for widening state highway in Byadagi","The High Court of Karnataka has quashed the land acquisition process in Byadagi taluk of Haveri district for widening a state highway there. Allowing a batch of five petitions filed by multiple property owners, the HC has held the state government's amendment to Section 34 of the Right to Fair Compensation and Transparency in Land Acquisition, Rehabilitation and Resettlement (Karnataka) Rules, as invalid in respect of the land acquisition process for these land owners. By a notification dated May 16, 2020, the state had exempted social impact assessment (SIA) and determination in relation to the proposed acquisition of land for State Highway-136, including the lands of the petitioners before the HC and other land owners. The petitioners in all the petitions claim to be the residents residing at Byadagi taluk, Haveri district, and have been carrying on business in the market area in the said town. Pursuant to the request dated February 20, 2019 made by the Deputy Commissioner, Haver","https://www.business-standard.com/article/current-affairs/karnataka-hc-quashes-land-acquisition-for-widening-state-highway-in-byadagi-122103000247_1.html","http://www.business-standard.com/rss/current-affairs-news-11501.rss","IN","general"
"2022-10-30 11:42:00+05:30","1667110320.0","Delhi air 'very poor'; farm fire smoke, slow wind may push it to 'severe'","Delhi recorded its air quality in the 'very poor' category on Sunday morning and forecasters said slow wind speed and an increase in stubble burning, especially in Punjab, may push it to the 'severe' zone. With pollution levels worsening, the Centre's air quality panel on Saturday directed authorities to impose a ban on construction and demolition activities in Delhi-NCR, except in essential projects, and other curbs under stage III of the Graded Response Action Plan. Delhi's overall air quality index (AQI) stood at 367 at 9 am. The 24-hour average AQI on Saturday was 397, the worst since January. It was 354 on Thursday, 271 on Wednesday, 302 on Tuesday and 312 on Monday (Diwali). Anand Vihar (AQI 468) was the most polluted place in the capital. Wazirpur (412), Vivek Vihar (423) and Jahangirpuri (407) were among the monitoring stations that recorded ""severe"" air quality. V K Soni, head of the India Meteorological Department's Environment Monitoring and Research Centre, said a layer","https://www.business-standard.com/article/current-affairs/delhi-air-very-poor-farm-fire-smoke-slow-wind-may-push-it-to-severe-122103000246_1.html","http://www.business-standard.com/rss/current-affairs-news-11501.rss","IN","general"
"2022-10-30 10:39:00+05:30","1667106540.0","World Thrift Day 2022: 5 simple ways you can adopt to become a better saver","On this World Thrift Day 2022, we speak with experts on ways a salaried person can increase their savings","https://www.business-standard.com/article/pf/world-thrift-day-2022-5-simple-ways-you-can-adopt-to-become-a-better-saver-122103000199_1.html","http://www.business-standard.com/rss/current-affairs-news-11501.rss","IN","general"
"2022-10-30 10:34:00+05:30","1667106240.0","UP CM to inaugurate India's largest data centre in Greater Noida on Oct 31","CM Yogi will be coming to Greater Noida on October 31 to inaugurate the country's largest and the state's first data centre","https://www.business-standard.com/article/current-affairs/up-cm-to-inaugurate-india-s-largest-data-centre-in-greater-noida-on-oct-31-122103000104_1.html","http://www.business-standard.com/rss/current-affairs-news-11501.rss","IN","general"
"2022-10-30 10:06:00+05:30","1667104560.0","PM to lay foundation for C-295 aircraft manufacturing facility in Vadodara","Prime Minister Narendra Modi will lay the foundation stone of C-295 transport aircraft manufacturing facility in Gujrat's Vadodara today","https://www.business-standard.com/article/current-affairs/pm-to-lay-foundation-for-c-295-aircraft-manufacturing-facility-in-vadodara-122103000102_1.html","http://www.business-standard.com/rss/current-affairs-news-11501.rss","IN","general"
"2022-10-30 10:02:00+05:30","1667104320.0","Everyone's life should be illuminated: PM Modi greets nation on Chhath puja","Prime Minister Narendra Modi on Sunday greeted the nation on the occasion of Chhath Puja. In a tweet, he noted that the festival is dedicated to worshipping the sun and nature, as he extended this greetings on this auspicious occasion. Crores of devotees will worship the setting sun this evening, and the rising sun on Monday morning. This festival is celebrated with particular fervour in Bihar and parts of Uttar Pradesh.","https://www.business-standard.com/article/current-affairs/everyone-s-life-should-be-illuminated-pm-modi-greets-nation-on-chhath-puja-122103000095_1.html","http://www.business-standard.com/rss/current-affairs-news-11501.rss","IN","general"
"2022-10-30 14:32:46+00:00","1667140366.0","‘Somebody’s going to die’: Democrats warn of political violence after Paul Pelosi attack","Dire warnings after hammer assault on speaker’s husband and amid concern that security does not adequately reflect threats Democratic politicians have ramped up their warnings about the threat of political violence in America after a man bludgeoned House Speaker Nancy Pelosi’s 82-year-old husband with a hammer in their California home on Friday. The dire warnings come amid longstanding concern that security services provided do not adequately reflect ongoing threats, especially as midterm elections loom. Continue reading...","https://www.theguardian.com/us-news/2022/oct/30/democrats-warn-political-violence-after-paul-pelosi-attack","http://www.theguardian.com/world/usa/rss","US","general"
"2022-10-30 12:52:48+00:00","1667134368.0","Eight-year-old boy becomes youngest person to ascend Yosemite’s El Capitan","Sam Adventure Baker has been ascending the terrifying rock wall rising 3,000ft with his father since Tuesday An eight-year-old boy has become the youngest person to ascend the terrifying sheer rock wall of El Capitan in America’s Yosemite national park, his father said in a Facebook post. Sam Adventure Baker has been going up the huge cliff with his father since Tuesday. The duo are part of a four-person team, where one person climbs ahead and sets the ropes for others to follow. Nights are spent sleeping on the rock face. Continue reading...","https://www.theguardian.com/us-news/2022/oct/30/boy-eight-climbs-el-capitan-yosemite","http://www.theguardian.com/world/usa/rss","US","general"
"2022-10-30 12:18:43+00:00","1667132323.0","Nancy Pelosi: family ‘heartbroken and traumatized’ by brutal attack on her husband","Speaker’s husband underwent surgery after hammer assault that comes amid rising warnings of political violence in the US House speaker Nancy Pelosi said her family is “heartbroken and traumatized” after a brutal and bloody hammer assault on her husband that has shocked the US as it stands on the brink of tense and crucial midterm elections. An intruder smashed his way through a rear door into the Pelosi’s house in San Francisco on Friday. The man confronted Paul Pelosi and shouted, “Where is Nancy.” Continue reading...","https://www.theguardian.com/us-news/2022/oct/30/paul-pelosi-attack-nancy-husband","http://www.theguardian.com/world/usa/rss","US","general"
"2022-10-30 12:06:42+00:00","1667131602.0","Calling all men: this is what we can do to help women feel safe exercising in the dark | Chris Boardman","We have to break the cycle of misogyny that makes women feel at risk: This Girl Can’s guide sets out steps you can take The clocks have gone back, the evenings are drawing in, the weather is changing. None of this makes it easier for people to exercise. For many, the winter nights can be a threat to mental wellbeing. People like me (men) have historically dealt with these winter fears by ignoring them. Active men like me love telling anyone who will listen how good exercise is for physical and mental health. And when my wife hasn’t immediately rushed out the house to jog around the block in the dark and gloom, I’ve just repeated the message, but louder. Continue reading...","https://www.theguardian.com/commentisfree/2022/oct/30/women-safe-exercise-in-the-dark","http://www.theguardian.com/world/usa/rss","US","general"
"2022-10-30 10:30:32+00:00","1667125832.0","Katie Ledecky smashes 1500m freestyle world record by nearly 10 seconds","American star sets world record in 1,500m freestyle Ten-time Olympic medalist finishes final in 15:08.24 Katie Ledecky is having a great time in her first competitive event of the season at this week’s Fina Swimming World Cup. Ledecky set a world record in the 1,500m freestyle on Saturday night at the Toronto Pan Am Sports Centre. Continue reading...","https://www.theguardian.com/sport/2022/oct/30/katie-ledecky-world-record-short-course-1500m-freestyle","http://www.theguardian.com/world/usa/rss","US","general"
"2022-10-30 10:16:25+00:00","1667124985.0","Twitter deal may signal point when the ‘everything bubble’ bursts","China’s property meltdown , the unwinding of QE and the tech stock plunge all show a fragile global financial ecosystem under stress There’s always one deal that symbolises the end of an era. In the early 2000s AOL’s merger with Time Warner served notice that the dot-com boom was over . Royal Bank of Scotland’s over-priced takeover of ABN Amro was followed by the global financial crisis of 2008-09. The question now is whether Elon Musk’s purchase of Twitter will be seen as the moment the global economy tipped into recession. The signs are not promising. Even before Musk sealed the deal, tech stocks had seen a sharp sell-off. The stock market value of Meta, the parent of Facebook, fell by $80bn on Thursday after Mark Zuckerberg’s company announced a 50% drop in third-quarter profits. The reason was simple: advertisers are reining in spending in response to slowing global growth. Continue reading...","https://www.theguardian.com/business/2022/oct/30/twitter-deal-may-signal-turning-point-when-the-everything-bubble-bursts","http://www.theguardian.com/world/usa/rss","US","general"
"2022-10-30 10:00:23+00:00","1667124023.0","US students on why affirmative action is crucial: ‘They need our voices’","Harvard and UNC attendees address how applicants’ backgrounds shape their lives as supreme court hears case When Andrew Brennen thinks about the US supreme court deliberations over race-conscious admissions, he reflects on his parents, both attorneys, and his brother. In 2009, his father, David, became the first Black dean of the University of Kentucky’s law school since the state desegregated its colleges and universities. “Had they not had access to higher education that they received, who knows what they would’ve been doing,” Brennen, who graduated from the University of North Carolina at Chapel Hill in 2019, says. “I’m thinking a lot about how different my life, my brother’s life, would be if affirmative action hadn’t been in place.” Continue reading...","https://www.theguardian.com/us-news/2022/oct/30/affirmative-action-race-conscious-admissions-students","http://www.theguardian.com/world/usa/rss","US","general"
"2022-10-30 10:00:23+00:00","1667124023.0","Ignore US government economy data – base your business decisions on actual data | Gene Marks","The US reported the GDP bounced back – but at best it’s preliminary data that’s revised multiple times. Info from the top two payroll services are a better bet Trying to figure out the future in the current climate is enough to give you a migraine. Where is the economy heading? Should you take risks or circle the wagons? Can you hire and spend or do you need to cut overhead and retract? People are relying on you to make the right decisions. But unfortunately, the data which most of us receive is not very helpful. For example, this week the US reported gross domestic product (GDP) – the broadest measure of the health of the economy – bounced back last quarter . Good news? My advice: ignore it. Why? Because like most of the big numbers that the government reports this number is based on surveys, and how accurate are you when you answer a survey? At worst, it’s inaccurate, at best, it’s merely preliminary data that’s revised multiple times over the succeeding months. By the time it’s finalized the data is too old to be of use to any business manager looking to figure out the economic future. Continue reading...","https://www.theguardian.com/business/2022/oct/30/small-business-us-economy-data","http://www.theguardian.com/world/usa/rss","US","general"
"2022-10-30 09:39:14+00:00","1667122754.0","‘I won’t stand down’: Nets’ Kyrie Irving defends post about antisemitic film","Nets star says he embraces all religions amid controversy Irving defends right to post after criticism from team owner Kyrie Irving said Saturday he embraced all religions, defiantly defending his right to post whatever he believes after the owner of the Brooklyn Nets said he was disappointed that Irving appeared to back an antisemitic film. “We’re in 2022. History is not supposed to be hidden from anybody and I’m not a divisive person when it comes to religion,” Irving said during a tense postgame press conference. “I embrace all walks of life.” Continue reading...","https://www.theguardian.com/sport/2022/oct/30/kyrie-irving-defends-post-antisemitic-film","http://www.theguardian.com/world/usa/rss","US","general"
"2022-10-30 09:00:23+00:00","1667120423.0","Satellite pictures shine light on the nations that inflate their GDP | Torsten Bell","Authoritarian regimes can be seen to be manipulating their economic growth rates to a greater extent than democracies A tweet from the author Nassim Nicholas Taleb caught my eye last week. Amid the merry-go-round of prime ministers, he told us all to “stop complaining about the turnover in Britain”. It caught my eye partly because I’d done some complaining myself in last week’s column . His argument was that it’s good that such fast turnover can happen and definitely preferable to “other nations that have NO turnover”, ie Russia and Saudi Arabia. The tweet prompted two reactions. The first and strongest was that, just maybe, we don’t face a binary choice between dictatorship and the recent chaos. But, second, that it’s always good to be reminded of the benefits of our democracy. Being able to dispense swiftly with leaders making big mistakes is important, as a US stuck with Trump for four years demonstrated. And there are some specific advantages for us economic researchers. Continue reading...","https://www.theguardian.com/commentisfree/2022/oct/30/satellite-pictures-shine-light-nations-that-inflate-gdp","http://www.theguardian.com/world/usa/rss","US","general"
"2022-10-30 08:00:22+00:00","1667116822.0","Rishi Sunak’s politics are wretched. But as a British Indian, I see why his rise to the top matters | Sonia Sodha","Attacks on the ethnic diversity of Tory cabinets have not been limited to the right; there is lack of nuance on all sides of the race debate As a Briton of Indian heritage, I had mixed feelings when I saw the images of the new prime minister, Rishi Sunak, celebrating Diwali at a Downing Street reception. Who could fail to be moved by the fact the UK has its first prime minister of colour? But there is also much I abhor about Sunak’s politics. Because there’s more to me than my ethnicity, I don’t have any trouble holding both these thoughts in my head at once. Sixty years ago, racial discrimination was perfectly legal: of course it matters that children can today see that you don’t have to be white to lead this country. But like his Tory predecessors at the Treasury, Sunak is a fiscal hawk, making unnecessarily harsh spending decisions that have resulted in significant hardship. Like many Conservatives, he does not appear to place much stock in the idea of structural discrimination, through which too many young people are held back from achieving their full potential because of their race or class background. Continue reading...","https://www.theguardian.com/commentisfree/2022/oct/30/rishi-sunak-politics-wretched-but-as-british-indian-i-see-why-his-rise-to-top-matters","http://www.theguardian.com/world/usa/rss","US","general"
"2022-10-30 08:00:22+00:00","1667116822.0","The pilots flying passengers across US state lines for abortions","Hundreds of pilots across the US have been volunteering the use of their small planes to fly people seeking the procedure from states that outlawed it All Steven knew was what time and where. A part-time pilot from the Chicago area, he was picking up a total stranger in his single-engine plane, a passenger who needed to fly more than a thousand miles, across state lines, from the midwest to the east coast. “Within 15, 20 minutes of arriving and meeting the person, we were in the plane and I got the engine fired up, ready to go,” he said. Continue reading...","https://www.theguardian.com/us-news/2022/oct/30/us-abortion-flights-elevated-access","http://www.theguardian.com/world/usa/rss","US","general"
"2022-10-30 08:00:22+00:00","1667116822.0","Kanye West’s voice is just one in a rising chorus of antisemitism","Every year, antisemitic incidences have increased. It’s clear that strategies for combatting race hatred are not working To be a Jew on social media is to be seated near the back by the toilets. There is a smell in the air and the door opens regularly, and occasionally the plumbing gets backed up which means you must spend some time wading grimly through shit. Like now, when ex-presidents and pop stars, people with more followers than there are Jews in the world, are posting that Jews had better start showing Trump some gratitude “before it is too late”, or that they’re planning to go “death con 3 On JEWISH PEOPLE.” All caps all Kanye’s. I’ve been reading and listening to a lot of stories about conspiracy theories recently. It’s hard to avoid them, maybe, but still, it feels necessary. The past few years, of pandemic and protests and poverty, have led to a rise in people trying to make sense of chaos, some of them leaning into mis- or disinformation. And by campaigning against Covid vaccines and public health measures, many have unknowingly attached themselves to conspiracy theories, some of them clear reincarnations of an ancient blood libel. Continue reading...","https://www.theguardian.com/lifeandstyle/2022/oct/30/eva-wiseman-kanye-west-voice-is-just-one-in-rising-chorus-of-antisemitism","http://www.theguardian.com/world/usa/rss","US","general"
"2022-10-30 07:00:19+00:00","1667113219.0","Will disruptive action help save the planet? | Rupert Read and Indigo Rumbelow","Is there any point throwing soup at a Van Gogh painting and mashed potato at a Monet? Two activists give their views Nothing’s worked. More diplomatically put: nothing has yet worked at anything like the pace required. Is it any wonder that desperation is growing? Continue reading...","https://www.theguardian.com/commentisfree/2022/oct/30/are-disruptive-tactics-winning-hearts-minds-bid-highlight-global-heating","http://www.theguardian.com/world/usa/rss","US","general"
"2022-10-30 06:30:19+00:00","1667111419.0","Halloween is bad enough, so why torture ourselves with scary films? | Emma John","The best horror movies thrill us with fear and pity – just the catharsis Aristotle looked for in tragedy I spent the past week in the mountains of western North Carolina, where the seasonal colour of the tree-covered Appalachians offers a fiery backdrop to small-town life. You can’t beat this place for autumnal vibes, with apple pies and cider on sale in every store, gourds and pumpkins in every layby. And then there are the Halloween decorations. People take them seriously here, their windows, lawns and roofs fantastically dressed in ways that range from the tastefully spooky to the unashamedly exhibitionist. My nearest neighbours have a menagerie of inflatables – a werewolf, a skeleton, a zombie – that blow up taller than their house. The folk I stay with, however, don’t construct ghosts out of bedsheets and brooms or hang up fake spiders’ webs on their porch. They have their own way of marking the season. For the whole of October, my friends Andrew and Carrie commit to watching a different horror film every day. To some, that will sound like psychological torture. But this is a couple who enjoy the genre so much that the first thing you pass on walking into their home is a floor-to-ceiling shelving unit of DVDs with names such as Chopping Mall and Slumber Party Massacre . Continue reading...","https://www.theguardian.com/commentisfree/2022/oct/30/halloween-bad-enough-why-torture-ourselves-scary-films","http://www.theguardian.com/world/usa/rss","US","general"
"2022-10-30 06:00:19+00:00","1667109619.0","Can Obama magic charm Democrats to the polls in crucial midterms?","The ex-president remains his party’s rock star and is touring key states to fire up voters – but his midterms record is far from flawless She never got to vote for him because she was too young. But when Barack Obama came to rally this week, Emma Berlage wouldn’t have missed him for the world. “It’s a Friday night, Halloween weekend no less, and everybody’s here,” the 24-year-old said. “ After he was president he’s continued to stay cool and very popular with Democrats.” More popular than the current president, Joe Biden? “Yes. I mean, in terms of coolness, yes! ” Continue reading...","https://www.theguardian.com/us-news/2022/oct/30/barack-obama-midterms-democrats-campaign-rally","http://www.theguardian.com/world/usa/rss","US","general"
"2022-10-30 04:51:03+00:00","1667105463.0","Vasiliy Lomachenko outpoints Ortiz in return from military service in Ukraine","Lomachenko defeats Ortiz by unanimous decision in New York Ukrainian star is targeting shot at unified champ Devin Haney Vasiliy Lomachenko is headed home to Ukraine, ready to resume military service during his country’s war with Russia. Next time he returns, he hopes it’s for a chance to become the undisputed lightweight champion. Continue reading...","https://www.theguardian.com/sport/2022/oct/30/vasiliy-lomachenko-jamaine-ortiz-fight-report","http://www.theguardian.com/world/usa/rss","US","general"
"2022-10-30 03:35:40+00:00","1667100940.0","Astros ambush Phillies’ Wheeler early to level World Series at one game apiece","Astros batter Phils’ ace and hold off late fightback in win As it happened: Astros win 5-2 over Phillies in Game 2 Framber Valdez swapped his glove and his spikes midgame. He repeatedly rubbed his hands. By the time he strode off the mound to a standing ovation and handed the Houston Astros’ bullpen a seventh-inning lead, it was clear he had thrown a curve at the Philadelphia Phillies. Continue reading...","https://www.theguardian.com/sport/2022/oct/29/world-series-game-2-phillies-astros-report","http://www.theguardian.com/world/usa/rss","US","general"
"2022-10-30 14:28:34+00:00","1667140114.0","Flammable devices hurled at migrant centre in Dover","Kent Police said the incident occurred on Sunday morning.","https://www.standard.co.uk/news/politics/dover-emergency-services-border-force-kent-police-b1036271.html","http://www.standard.co.uk/news/politics/rss","GB","politics"
"2022-10-30 13:03:42+00:00","1667135022.0","William and Kate offer ‘love and prayers’ after crowd surge in South Korea","More than 150 people were killed in the incident in Seoul on Saturday night, during Halloween festivities.","https://www.standard.co.uk/news/politics/william-and-kate-seoul-south-korea-james-cleverly-princess-b1036264.html","http://www.standard.co.uk/news/politics/rss","GB","politics"
"2022-10-30 12:53:50+00:00","1667134430.0","Truss’s investment zones under review as Gove draws environmental red lines","Investment zones were a key plank of the former prime minister’s plan for growth.","https://www.standard.co.uk/news/politics/michael-gove-rishi-sunak-kwasi-kwarteng-prime-minister-environment-secretary-b1036253.html","http://www.standard.co.uk/news/politics/rss","GB","politics"
"2022-10-30 12:48:46+00:00","1667134126.0","Homes for Ukraine scheme labelled ‘sea of ineptitude’ amid delays","Home Office data shows 101,200 Ukrainians have arrived in the UK under the scheme since March.","https://www.standard.co.uk/news/politics/homes-home-office-ukraine-haringey-kyiv-b1036263.html","http://www.standard.co.uk/news/politics/rss","GB","politics"
