"pubDate","timestamp","title","description","link","rss-url","country","category"
"2022-10-30 06:00:19+00:00","1667109619.0","Can Obama magic charm Democrats to the polls in crucial midterms?","The ex-president remains his party’s rock star and is touring key states to fire up voters – but his midterms record is far from flawless She never got to vote for him because she was too young. But when Barack Obama came to rally this week, Emma Berlage wouldn’t have missed him for the world. “It’s a Friday night, Halloween weekend no less, and everybody’s here,” the 24-year-old said. “ After he was president he’s continued to stay cool and very popular with Democrats.” More popular than the current president, Joe Biden? “Yes. I mean, in terms of coolness, yes! ” Continue reading...","https://www.theguardian.com/us-news/2022/oct/30/barack-obama-midterms-democrats-campaign-rally","http://www.theguardian.com/uk/rss","GB","general"
"2022-10-30 05:30:18+00:00","1667107818.0","The Observer view on Rishi Sunak’s shameful decision not to attend Cop27 | Observer editorial","The prime minister’s decision to shun the climate talks is a disgrace. Britain started this crisis; it should be helping end it It would be hard to exaggerate the importance of the Cop27 climate summit that is set to open in seven days in Sharm el-Sheikh, in Egypt. Soaring carbon emissions, set loose by humanity’s unrestrained urge to burn fossil fuels, have brought the planet perilously close to achieving a 1.5C degree rise in global temperatures. As a result, extreme storms, droughts and floods are already occurring more rapidly and with greater intensity than climate experts had anticipated. Worse, we are very near to triggering a wave of secondary calamities: the collapses of the Greenland and West Antarctic ice sheets; the destruction of all the planet’s tropical coral reefs; and the thawing of Canada and Russia’s permafrost systems, an event that would release vast stores of methane, a gas many times more potent and dangerous than carbon dioxide. It is a deeply disturbing vision. If such trends are not halted very soon, and emissions cut back and eventually halted, the world will experience, in a few decades, a meteorological catastrophe. Wildlife species will be eradicated in their thousands, droughts will spread over continents and famine will kill millions of people. We will have created a planet that has been stripped of its habitats and biological riches, a scorched and depleted world that we will pass on to our children and future generations. Only urgent action to cut carbon emissions, the prime driver of our climate woes, will stop this happening. Continue reading...","https://www.theguardian.com/commentisfree/2022/oct/30/observer-view-rishi-sunak-shameful-decision-not-to-attend-cop27","http://www.theguardian.com/uk/rss","GB","general"
"2022-10-30 05:00:18+00:00","1667106018.0","Thousands of mosques targeted as Hindu nationalists try to rewrite India’s history","Shamsi Jama Masjid, an 800-year-old mosque in Uttar Pradesh, is the latest flashpoint in a dispute that could eventually turn violent In a small, darkened office in Budaun, where dusty legal books line the walls, two lawyers have fallen into a squabble. VP Singh and his taller associate BP Singh – no relation – are discussing Shamsi Jama Masjid, the mosque that has stood in this small town in Uttar Pradesh for 800 years. According to the lawyers, this grand white-domed mosque, one of the largest and oldest in India, is not a mosque at all. “No no, this is a Hindu temple,” asserted BP Singh. “It’s a very holy place for Hindus.” Continue reading...","https://www.theguardian.com/world/2022/oct/30/thousands-of-mosques-targeted-as-hindu-nationalists-try-to-rewrite-indias-history","http://www.theguardian.com/uk/rss","GB","general"
"2022-10-30 05:00:17+00:00","1667106017.0","What TikTok does to your mental health: ‘It’s embarrassing we know so little’","Nearly six in 10 teenagers count themselves as daily users of the app yet little is known about the impacts on the brain Read the new Guardian series exploring the increasing power and reach of TikTok In the few years since its launch, TikTok has already altered the face of the social media landscape, attracting more than 1 billion users and leading competitors to replicate some of its most unique features. The impact of that explosive growth and the ‘TikTok-ification’ of the internet at large on social media users remains little understood, experts warn, exacerbating concerns about the impact of social media on our habits and mental health. Continue reading...","https://www.theguardian.com/technology/2022/oct/30/tiktok-mental-health-social-media","http://www.theguardian.com/uk/rss","GB","general"
"2022-10-30 05:00:17+00:00","1667106017.0","The Observer view on why we’re paying a high price to host the World Cup | Observer editorial","There is little evidence to back up claims that international sporting events do anything to discourage human rights abuses Qatar is a rich Gulf nation known for both its huge oil reserves and its flagrant human rights abuses. It is a dictatorship in which women have to seek permission from their male guardians to marry or work in many government jobs, in which being gay is criminalised and can result in a prison sentence, in which migrant workers are treated appallingly and in which journalists have been imprisoned for reporting critically on domestic politics. Yet all of this will inevitably be minimised as the world’s eyes fall on Qatar for the start of the 2022 World Cup next month. Qatar’s leaders know this and this is why they have paid through the nose – estimates put it at $220bn (£190bn), by far the most expensive World Cup of all time – to host the competition, including lavishing money on efforts to lobby British politicians, as we report today . And so football teams, international supporters, the world’s media and foreign dignitaries will duly head to Qatar for an international sporting tournament that has serious environmental implications and will, some predict, leave a huge carbon footprint . At a conservative estimate, at least 6,500 migrant workers have lost their lives n Qatar since it was awarded the World Cup in 2011. Continue reading...","https://www.theguardian.com/commentisfree/2022/oct/30/observer-view-high-price-qatar-host-world-cup","http://www.theguardian.com/uk/rss","GB","general"
"2022-10-30 05:00:17+00:00","1667106017.0","Nurses need a little nurturing | Letters","No wonder they are leaving the profession: nurses don’t expect to be rich, they just want to feel valued Torsten Bell is correct in his analysis of the exodus of nurses from the profession (“ When nursing staff head for the door, senior doctors are right behind ”, Comment). As a now retired nurse of more than 40 years’ experience, I can speak with some authority about why retention is so poor. Nurses never expect huge salaries or they wouldn’t have entered the profession in the first place. They do, however, expect to feel valued. If they were offered incentives such as subsidised housing, car parking and meals on duty (just like our MPs get), they would be less inclined to leave. Most nurses aren’t nomadic and value the chance to work flexibly to accommodate family life. A little nurturing would go a long way to improving retention. Teresa Curtis Cheadle Hulme, Stockport I am a consultant paediatric surgeon and am unable to function without the trained, talented, experienced nurses who are part of our team. We do not delegate. We have our overlapping roles and inform and guide each other. I am frequently guided by my nursing colleagues. They have skills I will never attain. My ability to work efficiently is dependent on these nurses. Delegation implies a hierarchy between surgeons and nurses that does not exist except in their salaries, which in turn does not reflect relative worth. Alan Bailie Belfast Continue reading...","https://www.theguardian.com/commentisfree/2022/oct/30/letters-nurses-need-a-little-nurturing","http://www.theguardian.com/uk/rss","GB","general"
"2022-10-30 04:00:16+00:00","1667102416.0","Hiroshima survivors plead for nuclear-free world as global tensions rise","Survivors of 1945 atomic bomb express deep concern amid bellicose rhetoric from Russia and North Korea Toshiyuki Mimaki was playing in front of his family home in Hiroshima on the morning of 6 August 1945 when he saw a flash in the sky – the moment the then three-year-old became witness to the world’s first atomic bombing. Almost eight decades on, the spectre of nuclear war has returned with greater menace than at any time since the cold war, amid Vladimir Putin’s threats against Ukraine and North Korea’s seemingly unstoppable rise to the status of nuclear-armed state . Continue reading...","https://www.theguardian.com/world/2022/oct/30/hiroshima-survivors-plead-for-nuclear-free-world-as-global-tensions-rise","http://www.theguardian.com/uk/rss","GB","general"
"2022-10-30 00:26:39+00:00","1667089599.0","Russia-Ukraine war at a glance: what we know on day 249 of the invasion","Russia suspends deal on Ukraine food exports citing attacks on Crimea ships; Ukrainian civilians get app to pinpoint Russian missiles and drones See all our Russia-Ukraine war coverage The Russian government has written to the United Nations saying it is indefinitely suspending the Black Sea grain deal that allowed vital exports of Ukrainian food supplies. Moscow also requested a related meeting of the UN security council in New York on Monday. The US president, Joe Biden, said Russia’s actions were outrageous. The UN secretary general urged Russia and Ukraine to renew the grain deal that has seen more than 8m tonnes of grain exported from Ukraine and brought down global food prices. The agreement between Ukraine and Russia was due to expire on 19 November. Britain’s Ministry of Defence said Russia’s defence ministry was “peddling false claims of an epic scale” after Moscow accused the British navy of a “terrorist attack” on Nord Stream gas pipelines and claimed British “specialists” aided a drone attack in Sevastopol. Britain’s MoD said: “This latest invented story says more about the arguments going on inside the Russian government than it does about the west.” Ukrainian electricity supplies were recovering after concerted Russian attacks on generating plants but emergency blackouts may still be needed, Volodymyr Zelenskiy said. “Today there are already significantly fewer stabilisation [measures] and emergency blackouts … but restrictions are still possible in some cities and districts.” The European Union has frozen Russian assets worth about €17bn (£14.6bn or $17bn) since Moscow invaded Ukraine, according to the EU justice commissioner, Didier Reynders. Up to 100 prisoners of war have reportedly been exchanged between Russia and Ukraine. Russia’s defence ministry said on Saturday that Ukraine handed over 50 prisoners of war after talks. The Ukrainian armed forces account posted on Telegram that “52 Ukrainians returned home” during another “exchange of prisoners”. The Ukrainian presidential aide Mykhailo Podolyak has expressed scepticism about the takeover of Twitter by Elon Musk. The billionaire and Tesla boss drew fury from Kyiv and praise from Moscow this month when he posted a Twitter poll proposing Ukraine permanently cede Crimea to Russia, that referendums be held under UN auspices on the fate of Russian-controlled territory, and that Ukraine agree to neutrality. Russian-backed forces say they have finished a pull-out of civilians from the key southern Ukrainian city of Kherson . The city had a population of about 288,000 people before the war and was one of the first to fall to Moscow’s troops after the February invasion. A Russian-installed official in Kherson said at least 70,000 people had left their homes in the space of a week. A mobile phone app has been developed by Ukrainian volunteers to allow civilians to report sightings of incoming Russian drones and missiles – and, it is hoped, increase the proportion shot down before they hit the ground. The app, ePPO, relies on a phone’s GPS and compass, and a user only has to point their device in the direction of the incoming object and press a button for it to send a location report to the military. Continue reading...","https://www.theguardian.com/world/2022/oct/30/russia-ukraine-war-at-a-glance-what-we-know-on-day-249-of-the-invasion","http://www.theguardian.com/uk/rss","GB","general"
"2022-10-29 23:04:27+00:00","1667084667.0","Jesse Marsch says Leeds have ‘stopped the bleeding’ after win over Liverpool","Summerville goal ends run of eight games without a win ‘The guys are happy – we have to use this to launch ourselves’ Jesse Marsch claimed Leeds had “stopped the bleeding” after they ended a run of eight Premier League games without a win by beating Liverpool for the first time since April 2001. Leeds, who started the day in the relegation zone and with their manager under intense pressure, produced a highly impressive away display to condemn Jürgen Klopp’s team to a first home league defeat in 30 matches. Continue reading...","https://www.theguardian.com/football/2022/oct/30/jesse-marsch-says-leeds-have-stopped-the-bleeding-after-win-over-liverpool","http://www.theguardian.com/uk/rss","GB","general"
"2022-10-29 22:06:54+00:00","1667081214.0","Braverman’s secret meetings with ‘anti-woke’ MP flagged by officials before she quit","Civil servants say there was ‘significant disquiet’ over home secretary Suella Braverman’s dealings with Tory rightwinger John Hayes Home Office officials raised concerns over a series of secretive meetings Suella Braverman held with an influential rightwing backbench MP weeks before she was forced to resign over leaking sensitive information to him, the Observer has been told. In addition, sources have claimed that the home secretary appears to have instructed officials to look at potentially implementing hardline proposals cooked up by a rightwing thinktank that would in effect prohibit “genuine refugees” from settling in the UK, a move that threatens an even more uncompromising approach to asylum seekers . Continue reading...","https://www.theguardian.com/politics/2022/oct/29/suella-braverman-secretive-meetings-antiwoke-mp-officials","http://www.theguardian.com/uk/rss","GB","general"
"2022-10-29 19:00:05+00:00","1667070005.0","No 10 alarm as Boris Johnson plans to attend Cop27 climate summit","Ex-PM’s Cop27 visit is seen as snub to Rishi Sunak as Labour attacks government’s policy failures on environmental crisis A row over prime minister Rishi Sunak’s refusal to attend the Cop27 climate summit took an extraordinary twist on Saturday night as the Observer was informed that his predecessor but one – Boris Johnson – is planning to attend the event. Several sources said they had been told that Johnson is intending to go to the crucial meeting of world leaders in Egypt to show his solidarity with the battle against the climate crisis . Continue reading...","https://www.theguardian.com/politics/2022/oct/29/no-10-alarm-as-boris-johnson-plans-to-attend-cop27-climate-summit","http://www.theguardian.com/uk/rss","GB","general"
"2022-10-29 18:22:45+00:00","1667067765.0","Graham Potter admits he looks ‘a bit of a fool’ after Chelsea’s defeat to Brighton","Coach’s trip to former team ends in 4-1 humiliation Potter says using Sterling and Pulisic as wing-backs backfired Graham Potter admitted he ended up looking “a bit of a fool” after his return to Brighton ended in a humiliating 4-1 defeat for Chelsea. While Potter said he had no reason to apologise after Brighton’s fans gave him a hostile reception at the Amex Stadium, he said his decision to use Raheem Sterling and Christian Pulisic as wing-backs had backfired. Chelsea were 3-0 down at half-time and Brighton, who targeted Pulisic and Sterling, could celebrate their first win under Roberto De Zerbi. Continue reading...","https://www.theguardian.com/football/2022/oct/29/graham-potter-admits-he-looks-a-bit-of-a-fool-after-chelseas-defeat-to-brighton","http://www.theguardian.com/uk/rss","GB","general"
"2022-10-29 17:52:13+00:00","1667065933.0","Banned British far-right figures return to Twitter within hours of takeover","Extreme group Britain First publishes series of anti-immigrant videos in first 24 hours after getting its new account Key figures on Britain’s far right who were previously banned from Twitter have been able to open new accounts, apparently without restrictions, after the platform’s takeover by Elon Musk. Britain First, an extreme group whose leader has spent time in jail for hate crimes against Muslims, rejoined the social media network on Friday. It had been banned in 2017 under Twitter’s hate speech rules after posting inflammatory anti-Muslim videos. Some videos posted by its then deputy leader were retweeted by US president Donald Trump . Continue reading...","https://www.theguardian.com/politics/2022/oct/29/banned-british-far-right-figures-return-to-twitter-within-hours-of-takeover","http://www.theguardian.com/uk/rss","GB","general"
"2022-10-29 16:46:53+00:00","1667062013.0","Russia suspends Ukraine grain deal after attack on Sevastopol naval base","Move comes after assault by airborne and underwater drones in which flagship may be been damaged Russia-Ukraine war – latest news updates Russia has said it will pull out of a UN-brokered grain export deal after a dramatic attack by Ukrainian airborne and underwater drones on its Black Sea naval base of Sevastopol in the early hours of Saturday morning. Social media showed footage of explosions both near and in the Crimean harbour , and Russia’s defence ministry said there had been an attack by “nine unmanned aerial vehicles and seven autonomous sea drones” that began at 4.20am. Continue reading...","https://www.theguardian.com/world/2022/oct/29/russia-suspends-ukraine-grain-deal-after-attack-on-sevastopol-naval-base","http://www.theguardian.com/uk/rss","GB","general"
"2022-10-29 16:38:09+00:00","1667061489.0","Iran accuses journalists who reported Mahsa Amini’s death of spying for CIA","Spying charge levelled at Niloofar Hamedi and Elahe Mohammadi carries death penalty as Tehran seeks to suppress running protests Two female journalists who were instrumental in reporting the death of Mahsa Amini, the 22-year-old woman whose death in the custody of Iran’s morality police has sparked nationwide protests, have been labelled as CIA foreign agents by the Iranian regime. Niloofar Hamedi and Elahe Mohammadi, who were arrested shortly after news broke of Amini’s death and who are reportedly being held in Iran’s notorious Evin prison, were accused of being foreign agents in a joint statement released by Iran’s ministry of intelligence and the intelligence organisation of the Islamic Revolutionary Guards last night. Continue reading...","https://www.theguardian.com/global-development/2022/oct/29/iran-accuses-journalists-who-reported-mahsa-aminis-death-of-spying-for-cia","http://www.theguardian.com/uk/rss","GB","general"
"2022-10-29 16:00:03+00:00","1667059203.0","The labyrinthine patterns traced by birds on the wing – in pictures","On a hike one day, photographer Xavier Bou , who is based in Barcelona, wondered if the flight paths of birds could be captured on paper. Through research he realised they could – and represented in a single image. Since then he’s recorded the labyrinthine patterns created by birds on the wing, a project published next month as a book called Ornithographies (Lynx Edicions) . “We’re at a point in history where conservation is no longer an eccentric hobby,” says Bou. “It is a necessity. I hope Ornithographies encourages people to become aware of the birds around us… just raise your head and – who knows – maybe a beautiful formation of migrating geese will pass by.” Continue reading...","https://www.theguardian.com/artanddesign/gallery/2022/oct/29/xavier-bou-ornithographies-birds-patterns-flight-in-pictures","http://www.theguardian.com/uk/rss","GB","general"
"2022-10-29 15:00:04+00:00","1667055604.0","Fisker Inc founder Henrik Fisker: pedigree carmaker going electric","After a failed first attempt, the car entrepreneur has revised his design and manufacturing ideas – and will have battery-powered vehicles ready for delivery next month Henrik Fisker is under no illusions about how hard it is to start an electric car company from scratch. He should know: his first attempt ended in bankruptcy. The second attempt is going better so far: his company, Fisker Inc, claims to be the only one of a batch of would-be Tesla challengers that has not had to push back its production schedule. “Most of the startup companies are fairly naive at the beginning,” he says. “We didn’t have that. We knew it was going to be expensive. We know manufacturing is difficult.” Continue reading...","https://www.theguardian.com/environment/2022/oct/29/fisker-inc-founder-henrik-fisker-pedigree-carmaker-going-electric","http://www.theguardian.com/uk/rss","GB","general"
"2022-10-29 15:00:01+00:00","1667055601.0","Soaring borrowing costs heap pressure on indebted UK firms","For companies in need of finance to expand – or just survive – rising interest rates and inflation make a scary combination, especially as recession looms It was a photo that marked the end of an era. Morrisons boss David Potts, in a black open-necked shirt, standing in a garden at the supermarket group’s Bradford headquarters, beside a statue of founder Ken Morrison. Standing chatting to him is the former Tesco supremo Sir Terry Leahy. They were celebrating a landmark deal that last year saw the grocery chain taken off the stock market and into private hands. Leahy, now an adviser to the buyout giant Clayton Dubilier &amp; Rice (CD&amp;R), had helped it outbid rival US private equity firm Fortress for Morrisons. The deal, which involved loading the business with debt in a sector known for slim margins and cutthroat competition, was a big bet on growth. Continue reading...","https://www.theguardian.com/business/2022/oct/29/soaring-borrowing-costs-heap-pressure-on-indebted-uk-firms","http://www.theguardian.com/uk/rss","GB","general"
"2022-10-30 20:10:57+05:30","1667140857.0","Mysuru region experiences excess post-monsoon rainfall","Chamarajanagar district has experienced unprecedented rains this year and this has left the farming community in distress. Against a normal of 320 mm between June and September, Chamarajanagar received 510 mm of rains this year.","https://www.thehindu.com/news/national/karnataka/mysuru-region-experiences-excess-post-monsoon-rainfall/article66073751.ece","http://www.thehindu.com/news/national/?service=rss","IN","general"
"2022-10-30 20:10:57+05:30","1667140857.0","Mysuru region experiences excess post-monsoon rainfall","Chamarajanagar district has experienced unprecedented rains this year and this has left the farming community in distress. Against a normal of 320 mm between June and September, Chamarajanagar received 510 mm of rains this year.","https://www.thehindu.com/news/national/karnataka/mysuru-region-experiences-excess-post-monsoon-rainfall/article66073751.ece","http://www.thehindu.com/news/national/?service=rss","IN","politics"
"2022-10-30 20:09:48+05:30","1667140788.0","Over 350 fall into river after suspension bridge collapses in Gujarat&#039;s Morbi","Prime Minister’s Office announces ex-gratia; Home Ministry directs NDRF teams to reach Morbi as soon as possible.","https://www.thehindu.com/news/national/other-states/scores-fall-into-river-after-suspension-bridge-collapses-in-gujarats-morbi/article66074252.ece","http://www.thehindu.com/news/national/?service=rss","IN","general"
"2022-10-30 20:09:48+05:30","1667140788.0","Over 350 fall into river after suspension bridge collapses in Gujarat&#039;s Morbi","Prime Minister’s Office announces ex-gratia; Home Ministry directs NDRF teams to reach Morbi as soon as possible.","https://www.thehindu.com/news/national/other-states/scores-fall-into-river-after-suspension-bridge-collapses-in-gujarats-morbi/article66074252.ece","http://www.thehindu.com/news/national/?service=rss","IN","politics"
"2022-10-30 20:07:34+05:30","1667140654.0","Lack of solidarity among trade unions threatening workers interest, says veteran activist","He was speaking at the 103rd Foundation Day of All India Trade Union Congress (AITUC) and said that the situation had worsened since the last 8 years ever since the BJP government came to power at the Centre","https://www.thehindu.com/news/national/karnataka/lack-of-solidarity-among-trade-unions-threatening-workers-interest-says-veteran-activist/article66073608.ece","http://www.thehindu.com/news/national/?service=rss","IN","general"
"2022-10-30 20:07:34+05:30","1667140654.0","Lack of solidarity among trade unions threatening workers interest, says veteran activist","He was speaking at the 103rd Foundation Day of All India Trade Union Congress (AITUC) and said that the situation had worsened since the last 8 years ever since the BJP government came to power at the Centre","https://www.thehindu.com/news/national/karnataka/lack-of-solidarity-among-trade-unions-threatening-workers-interest-says-veteran-activist/article66073608.ece","http://www.thehindu.com/news/national/?service=rss","IN","politics"
