"pubDate","timestamp","title","description","link","rss-url","country","category"
"2022-10-30 20:16:13+05:30","1667141173.0","US midterm elections 2022: Former President Barack Obama campaigns for Democrats in Detroit","","https://economictimes.indiatimes.com/news/international/us/us-midterm-elections-2022-former-president-barack-obama-campaigns-for-democrats-in-detroit/videoshow/95185497.cms","http://economictimes.indiatimes.com/News/rssfeeds/1715249553.cms","IN","general"
"2022-10-30 20:02:51+05:30","1667140371.0","Congress to launch 'Parivartan Sankalp Yatra' in poll-bound Gujarat from Oct 31","""The Congress' 'Parivartan Sankalp Yatra' will be launched in five zones of Gujarat, and 145 public meetings and 95 rallies will be organised throughout the journey. The yatra, which will cover 5,432 km, aims to establish direct contact with 4.5 crore people,"" state Congress president Jagdish Thakor said. More than one million party workers will join the yatra and the opposition party will spread the message of 11 promises that it has said it will fulfill when voted to power, he said.","https://economictimes.indiatimes.com/news/politics-and-nation/congress-to-launch-parivartan-sankalp-yatra-in-poll-bound-gujarat-from-oct-31/articleshow/95185308.cms","http://economictimes.indiatimes.com/News/rssfeeds/1715249553.cms","IN","general"
"2022-10-30 20:01:40+05:30","1667140300.0","Prince Harry and Meghan Markle likely to skip Christmas celebrations with royal family","The relationship between Prince Harry and his family back home in the UK has reportedly hit rock bottom, and that may be the reason a planned Christmas visit is out of the question this year.","https://economictimes.indiatimes.com/news/international/uk/prince-harry-and-meghan-markle-likely-to-skip-christmas-celebrations-with-royal-family/articleshow/95185286.cms","http://economictimes.indiatimes.com/News/rssfeeds/1715249553.cms","IN","general"
"2022-10-30 20:01:15+05:30","1667140275.0","Gujarat: Hanging bridge in Morbi collapses; several feared injured","","https://economictimes.indiatimes.com/news/india/gujarat-hanging-bridge-in-morbi-collapses-several-feared-injured/videoshow/95185277.cms","http://economictimes.indiatimes.com/News/rssfeeds/1715249553.cms","IN","general"
"2022-10-30 19:50:53+05:30","1667139653.0","Cable bridge collapses in Gujarat's Morbi, several feared injured","Gujarat Chief Minister Bhupender Patel said instructions have been given to the officials to arrange immediate treatment for the injured.","https://economictimes.indiatimes.com/news/india/cable-bridge-collapses-in-gujarats-morbi-several-feared-injured/articleshow/95185128.cms","http://economictimes.indiatimes.com/News/rssfeeds/1715249553.cms","IN","general"
"2022-10-30 19:50:43+05:30","1667139643.0","Jack Dorsey plans an alternative social media platform as Elon Musk takes over Twitter: Report","Last week, Twitter co-founder Jack Dorsey said that his app Bluesky aims to compete with any business seeking to control the underlying technologies of social media or the personal information of its users.","https://economictimes.indiatimes.com/news/international/us/jack-dorsey-plans-an-alternative-social-media-platform-as-elon-musk-takes-over-twitter-report/articleshow/95185041.cms","http://economictimes.indiatimes.com/News/rssfeeds/1715249553.cms","IN","general"
"2022-10-30 19:50:10+05:30","1667139610.0","BJP will definitely form government after polls: Himachal CM Jairam Thakur","The Vijay Sankalp Abhiyan has started in the state today and under this, all senior BJP leaders, union ministers, and the ministers of the state will conduct public rallies in each constituency.","https://economictimes.indiatimes.com/news/politics-and-nation/bjp-will-definitely-form-government-after-polls-himachal-cm-jairam-thakur/articleshow/95185129.cms","http://economictimes.indiatimes.com/News/rssfeeds/1715249553.cms","IN","general"
"2022-10-30 19:50:10+05:30","1667139610.0","BJP will definitely form government after polls: Himachal CM Jairam Thakur","The Vijay Sankalp Abhiyan has started in the state today and under this, all senior BJP leaders, union ministers, and the ministers of the state will conduct public rallies in each constituency.","https://economictimes.indiatimes.com/news/elections/assembly-elections/himachal-pradesh/bjp-will-definitely-form-government-after-polls-himachal-cm-jairam-thakur/articleshow/95185108.cms","http://economictimes.indiatimes.com/News/rssfeeds/1715249553.cms","IN","general"
"2022-10-30 19:48:58+05:30","1667139538.0","US Midterm Election 2022: Date, schedule, timings, ratings, opinion polls, exit polls, results; all that you need to know","Despite the Joe Biden administration's upbeat reassurances, are voters still feeling the bite of inflation in diet, grocery list, drives, and vacation plans? US midterm elections, often seen as a referendum on the president, are all set to present an opportunity for voters to send their message to the White House, and witness a change, if there any!","https://economictimes.indiatimes.com/news/international/us/us-midterm-election-2022-date-schedule-timings-ratings-opinion-polls-exit-polls-results-all-that-you-need-to-know/articleshow/95184852.cms","http://economictimes.indiatimes.com/News/rssfeeds/1715249553.cms","IN","general"
"2022-10-30 19:47:39+05:30","1667139459.0","Chennai to host squash World Cup in 2023, WSF chief says India ""important territory""","The relaunched World Cup in 2023 would be held in the city following the signing of a multiyear agreement with the Squash Rackets Federation of India. Wooldridge said apart from the World Cup, the WSF is looking to host a world doubles event in the city in 2024.","https://economictimes.indiatimes.com/news/sports/chennai-to-host-squash-world-cup-in-2023-wsf-chief-says-india-important-territory/articleshow/95185091.cms","http://economictimes.indiatimes.com/News/rssfeeds/1715249553.cms","IN","general"
"2022-10-30 19:45:45+05:30","1667139345.0","Delhi: Police issues traffic advisory for Chhath Puja","The advisory, issued on Sunday, is for diverting vehicles in and around Wazirabad and near ITO to alternative routes in view of celebrations in these areas.","https://economictimes.indiatimes.com/news/india/delhi-police-issues-traffic-advisory-for-chhath-puja/articleshow/95185018.cms","http://economictimes.indiatimes.com/News/rssfeeds/1715249553.cms","IN","general"
"2022-10-30 19:43:42+05:30","1667139222.0","President Joe Biden shocks internet after claiming there are '54 states' in US. Watch video","On Friday, during a speech at a Pennsylvania Democratic Party reception, US President Joe Biden claimed that he had campaigned in 54 states, gaining attention over the internet.","https://economictimes.indiatimes.com/news/international/us/president-joe-biden-shocks-internet-after-claiming-there-are-54-states-in-us-watch-video/articleshow/95185024.cms","http://economictimes.indiatimes.com/News/rssfeeds/1715249553.cms","IN","general"
"2022-10-30 19:42:35+05:30","1667139155.0","'Deserve to be here': Harvard students defend minority admissions","Harvard, like other competitive US universities, takes race into account as it seeks to ensure a diverse student body and has programs specifically designed to attract minorities.","https://economictimes.indiatimes.com/news/international/world-news/deserve-to-be-here-harvard-students-defend-minority-admissions/articleshow/95185007.cms","http://economictimes.indiatimes.com/News/rssfeeds/1715249553.cms","IN","general"
"2022-10-30 19:38:42+05:30","1667138922.0","Kanye West loses over $1 billion in deals, says he’s been ‘Beat to a Pulp’","Kanye West has reportedly lost over $1 billion after top brands like Adidas, GAP, and Balenciaga terminated their relationship over his controversial comments.","https://economictimes.indiatimes.com/news/international/us/kanye-west-loses-over-1-billion-in-deals-says-hes-been-beat-to-a-pulp/articleshow/95184969.cms","http://economictimes.indiatimes.com/News/rssfeeds/1715249553.cms","IN","general"
"2022-10-30 19:35:43+05:30","1667138743.0","Students defy Iran protest ultimatum, unrest enters more dangerous phase","Videos from universities in some other cities also showed Basij forces opening fire at students. Across the country, security forces tried to block students inside university buildings, firing tear gas and beating protesters with sticks. The students, who appeared to be unarmed, pushed back, with some chanting ""dishonoured Basij get lost"" and ""Death to Khamenei"".","https://economictimes.indiatimes.com/news/international/world-news/students-defy-iran-protest-ultimatum-unrest-enters-more-dangerous-phase/articleshow/95184931.cms","http://economictimes.indiatimes.com/News/rssfeeds/1715249553.cms","IN","general"
"2022-10-30 19:35:28+05:30","1667138728.0","Elon Musk plans job cuts at Twitter, asks managers for list of employees to be laid off","According to the New York Times, Elon Musk intends to start firing current employees at Twitter as early as this Saturday.","https://economictimes.indiatimes.com/news/international/us/elon-musk-plans-job-cuts-at-twitter-asks-managers-for-list-of-employees-to-be-laid-off/articleshow/95184920.cms","http://economictimes.indiatimes.com/News/rssfeeds/1715249553.cms","IN","general"
"2022-10-30 19:26:59+05:30","1667138219.0","Rahul Gandhi proved his leadership abilities through Bharat Jodo Yatra: TMC's Shatrughan Sinha","""Bharat Jodo Yatra is getting a very good response. Rahul Gandhi's charisma has started working, and he is getting an excellent response from the people. I feel that Gandhi's yatra will help double the tally of the Congress in Parliament in the next Lok Sabha polls,"" TMC MP Shatrughan Sinha said.","https://economictimes.indiatimes.com/news/politics-and-nation/rahul-gandhi-proved-his-leadership-abilities-through-bharat-jodo-yatra-tmcs-shatrughan-sinha/articleshow/95184766.cms","http://economictimes.indiatimes.com/News/rssfeeds/1715249553.cms","IN","general"
"2022-10-30 19:25:50+05:30","1667138150.0","Five killed, two injured as old building collapses in Maharashtra's Amravati","After the building collapsed, the bodies of the persons buried under the debris were brought out by the rescue team. But the rescue work is still on, District Collector Pavneet Kaur said, adding that the incident will be investigated and strict action will be taken against those responsible.","https://economictimes.indiatimes.com/news/india/five-killed-two-injured-as-old-building-collapses-in-maharashtras-amravati/articleshow/95184742.cms","http://economictimes.indiatimes.com/News/rssfeeds/1715249553.cms","IN","general"
"2022-10-30 19:14:15+05:30","1667137455.0","NASA captures Sun smiling! Photo inside","It may surprise you but NASA has captured the sun smiling in its latest photo! NASA's Solar Dynamics Observatory found that the sun's atmosphere appeared like a face. And it looks like a smiling face.","https://economictimes.indiatimes.com/news/science/nasa-captures-sun-smiling-photo-inside/articleshow/95184525.cms","http://economictimes.indiatimes.com/News/rssfeeds/1715249553.cms","IN","general"
"2022-10-30 19:13:25+05:30","1667137405.0","Jammu and Kashmir Rozgar Mela: This decade of 21st century is most important decade in history of J&K, says PM Modi","","https://economictimes.indiatimes.com/news/india/jammu-and-kashmir-rozgar-mela-this-decade-of-21st-century-is-most-important-decade-in-history-of-jk-says-pm-modi/videoshow/95184509.cms","http://economictimes.indiatimes.com/News/rssfeeds/1715249553.cms","IN","general"
"2022-10-30 19:09:44+05:30","1667137184.0","Itaewon an inclusive, multicultural hub hit following stampede in Seoul","Witnesses say the streets were so densely clogged with people and slow-moving vehicles that it was practically impossible for emergency workers and ambulances to arrive in time, leaving them helpless to prevent the situation from developing into the country's worst disaster in years. On Saturday night, emergency workers were seen rushing to carry the injured and dead out in stretchers as ambulances lined up in the streets and a chaotic crowd fled the area.","https://economictimes.indiatimes.com/news/international/world-news/itaewon-an-inclusive-multicultural-hub-hit-following-stampede-in-seoul/articleshow/95184407.cms","http://economictimes.indiatimes.com/News/rssfeeds/1715249553.cms","IN","general"
"2022-10-30 19:06:56+05:30","1667137016.0","Project C-295: Key things to know about Indian defence industry's big moment","For India, the new facility is seen meeting a major defence need — plugging a big missing link in the country's military industrial complex. As of now, forces in India have to depend on the old Avro planes of the 1960 generation for their transportation requirements.","https://economictimes.indiatimes.com/news/defence/project-c-295-key-things-to-know-about-indian-defence-industrys-big-moment/articleshow/95184369.cms","http://economictimes.indiatimes.com/News/rssfeeds/1715249553.cms","IN","general"
"2022-10-30 19:02:32+05:30","1667136752.0","Labour MP Yvette Cooper criticizes UK PM Rishi Sunak selecting Suella Braverman as Home Secretary. Here's what she said","After becoming the Prime Minister of the UK, Rishi Sunak renewed Suella Braverman's position as Home Secretary. Previously, she resigned under Liz Truss' short-lived administration.","https://economictimes.indiatimes.com/news/international/uk/labour-mp-yvette-cooper-criticizes-uk-pm-rishi-sunak-selecting-suella-braverman-as-home-secretary-heres-what-she-said/articleshow/95184323.cms","http://economictimes.indiatimes.com/News/rssfeeds/1715249553.cms","IN","general"
"2022-10-30 18:49:11+05:30","1667135951.0","Jammu & Kashmir: Pakistan trying to push terrorists near LOC, says J&K DGP Dilbagh Singh","","https://economictimes.indiatimes.com/news/defence/jammu-kashmir-pakistan-trying-to-push-terrorists-near-loc-says-jk-dgp-dilbagh-singh/videoshow/95184166.cms","http://economictimes.indiatimes.com/News/rssfeeds/1715249553.cms","IN","general"
"2022-10-30 18:44:50+05:30","1667135690.0","Sans Covid curbs, thousands throng ghats in Delhi for Chhath Puja","Chhath puja is celebrated on the sixth day after Diwali and is also known as Surya Sashthi as it is dedicated to the Sun God. It is one of the most popular festivals in eastern Uttar Pradesh and Bihar. After two years of Covid-induced restrictions, Chhath Puja is being celebrated this year at public places on a large scale in Delhi.","https://economictimes.indiatimes.com/news/india/sans-covid-curbs-thousands-throng-ghats-in-delhi-for-chhath-puja/articleshow/95184092.cms","http://economictimes.indiatimes.com/News/rssfeeds/1715249553.cms","IN","general"
"2022-10-30 18:35:29+05:30","1667135129.0","Man attacks UK migrant processing centre, kills himself","The attacker, a white man in a striped top, drove up to the centre in a white SEAT sports utility vehicle. He got out and threw three petrol bombs, one of which did not go off, the photographer said. He then drove to a nearby petrol station, tied an improvised noose around his neck, attached it to a metal pole and drove off, killing himself, the photographer said.","https://economictimes.indiatimes.com/news/international/world-news/man-attacks-uk-migrant-processing-centre-kills-himself/articleshow/95183900.cms","http://economictimes.indiatimes.com/News/rssfeeds/1715249553.cms","IN","general"
"2022-10-30 18:34:18+05:30","1667135058.0","Bharat Jodo Yatra to unite whom? Congress and Pandit Nehru divided India: MP CM Shivraj Singh Chouhan","""On one side there is Narendra Modi who is working for the country and on the other side there is Rahul baba (Rahul Gandhi) who is doing Bharat Jodo Yatra. Mr Rahul Gandhi, do tell us- who did the 'thodo' (divided) of India? In 1947 with an urge to get power at the earliest, if someone divided the country it was Pandit Jawaharlal Nehru and the Congress,"" Shivraj Singh Chouhan said.","https://economictimes.indiatimes.com/news/politics-and-nation/bharat-jodo-yatra-to-unite-whom-congress-and-pandit-nehru-divided-india-mp-cm-shivraj-singh-chouhan/articleshow/95183886.cms","http://economictimes.indiatimes.com/News/rssfeeds/1715249553.cms","IN","general"
"2022-10-30 18:29:52+05:30","1667134792.0","T20 World Cup: Suryakumar Yadav shines brightly as Indians bounced out on pacy Perth","Perhaps the world's most decorated T20I batter in recent times, Surya's pulled six and a bowler's back-drive boundary off Lungi Ngidi to complete his half-century will be remembered for times to come. His 68 off 40 balls will be in ICC's T20 'Hall Of Fame' and how he looked like batter from another planet was evident with the second best score being 15.","https://economictimes.indiatimes.com/news/sports/t20-world-cup-suryakumar-yadav-shines-brightly-as-indians-bounced-out-on-pacy-perth/articleshow/95183813.cms","http://economictimes.indiatimes.com/News/rssfeeds/1715249553.cms","IN","general"
"2022-10-30 18:25:57+05:30","1667134557.0","Philippine storm victims feared tsunami, ran toward mudslide","Nalgae, which had vast rain clouds, left at least 73 people dead in eight provinces and one city in the Philippine archipelago, including in Kusiong, and a trail of destruction and flooding in one of the world's most disaster-prone countries.","https://economictimes.indiatimes.com/news/international/world-news/philippine-storm-victims-feared-tsunami-ran-toward-mudslide/articleshow/95183755.cms","http://economictimes.indiatimes.com/News/rssfeeds/1715249553.cms","IN","general"
"2022-10-30 18:24:38+05:30","1667134478.0","Pakistan keep World Cup hopes alive, Bangladesh win thriller","Pakistan hammered the Netherlands by six wickets in Perth, reaching their target of 92 off just 13.5 overs to boost their net run rate, crucial in a tight Group 2.","https://economictimes.indiatimes.com/news/sports/pakistan-keep-world-cup-hopes-alive-bangladesh-win-thriller/articleshow/95183733.cms","http://economictimes.indiatimes.com/News/rssfeeds/1715249553.cms","IN","general"
"2022-10-30 18:18:51+05:30","1667134131.0","Joe Biden faces 'unpredictable' era with China's empowered Xi Jinping","Xi has amassed a measure of power over China's ruling party unseen since Mao Zedong, the leader from 1949 until his death in 1976. Xi's consolidation of power comes as the United States has updated its defense and national security strategies to reflect that China is now America's most potent military and economic adversary.","https://economictimes.indiatimes.com/news/international/world-news/joe-biden-faces-unpredictable-era-with-chinas-empowered-xi-jinping/articleshow/95183650.cms","http://economictimes.indiatimes.com/News/rssfeeds/1715249553.cms","IN","general"
"2022-10-30 18:17:47+05:30","1667134067.0","Maharashtra: Robert Vadra hails 'Bharat Jodo Yatra', likens Rahul Gandhi to Shirdi's Saibaba","On the ongoing 'Bharat Jodo Yatra', Robert Vadra said, ""Rahul Gandhi is visiting a number of places and meeting thousands of people. These people are joining him in large numbers. Change will come in the future as Rahul Gandhi is the new hope for people.""","https://economictimes.indiatimes.com/news/politics-and-nation/maharashtra-robert-vadra-hails-bharat-jodo-yatra-likens-rahul-gandhi-to-shirdis-saibaba/articleshow/95183637.cms","http://economictimes.indiatimes.com/News/rssfeeds/1715249553.cms","IN","general"
"2022-10-30 18:17:20+05:30","1667134040.0","Northern Ireland's Londonderry hosts Europe's biggest Halloween event. Details here","One of the first significant events in Northern Ireland after the limitations were loosened was the Halloween celebration that was held in Londonderry last year.","https://economictimes.indiatimes.com/news/international/uk/northern-irelands-londonderry-hosts-europes-biggest-halloween-event-details-here/articleshow/95183631.cms","http://economictimes.indiatimes.com/News/rssfeeds/1715249553.cms","IN","general"
"2022-10-30 18:10:46+05:30","1667133646.0","Olympic gold medallist Vasiliy Lomachenko fights back to defeat Jamaine Ortiz","Vasiliy Lomachenko was not expecting such a tough match-up but was matched very well on Saturday night in New York. The win could set up a match against Devin Haney.","https://economictimes.indiatimes.com/news/international/us/olympic-gold-medallist-vasiliy-lomachenko-fights-back-to-defeat-jamaine-ortiz/articleshow/95183493.cms","http://economictimes.indiatimes.com/News/rssfeeds/1715249553.cms","IN","general"
"2022-10-30 18:07:34+05:30","1667133454.0","T20 WC: Rohit Sharma becomes highest-capped player in tournament history","In 36 matches across 31 innings, Rohit has scored 919 runs at an average of 36.76 and a strike rate of 130.73. Nine half-centuries have come off his bat, with best score of 79*. He is the fourth-highest run scorer in tournament history. He also has the most sixes by an Indian player in tournament history.","https://economictimes.indiatimes.com/news/sports/t20-wc-rohit-sharma-becomes-highest-capped-player-in-tournament-history/articleshow/95183456.cms","http://economictimes.indiatimes.com/News/rssfeeds/1715249553.cms","IN","general"
"2022-10-30 18:00:25+05:30","1667133025.0","Delhi air in 'very poor' zone, stubble burning share rises to 26 per cent","With pollution levels worsening, the Centre's air quality panel on Saturday directed authorities to impose a ban on construction and demolition activities in Delhi-NCR, except in essential projects, and other curbs under stage III of the Graded Response Action Plan.","https://economictimes.indiatimes.com/news/india/delhi-air-in-very-poor-zone-stubble-burning-share-rises-to-26-per-cent/articleshow/95183333.cms","http://economictimes.indiatimes.com/News/rssfeeds/1715249553.cms","IN","general"
"2022-10-30 18:00:15+05:30","1667133015.0","Seoul Halloween stampede: India stands in solidarity with South Korea, says EAM Jaishankar","","https://economictimes.indiatimes.com/news/india/seoul-halloween-stampede-india-stands-in-solidarity-with-south-korea-says-eam-jaishankar/videoshow/95183330.cms","http://economictimes.indiatimes.com/News/rssfeeds/1715249553.cms","IN","general"
"2022-10-30 17:58:04+05:30","1667132884.0","Megan Fox and Machine Gun Kelly dress up as Pamela Anderson and Tommy Lee for Halloween party. See pics here","Megan Fox and Machine Gun Kelly appeared as Pamela Anderson and Tommy Lee's split images as they dress up for a Halloween party.","https://economictimes.indiatimes.com/news/international/us/megan-fox-and-machine-gun-kelly-dress-up-as-pamela-anderson-and-tommy-lee-for-halloween-party-see-pics-here/articleshow/95183176.cms","http://economictimes.indiatimes.com/News/rssfeeds/1715249553.cms","IN","general"
"2022-10-30 17:57:36+05:30","1667132856.0","DH Peligro of 'Dead Kennedys' dies after accidental fall at home, says band","In a statement on Instagram, the ""Dead Kennedys"" announced that long-time drummer DH Peligro passed away on October 28, after a fall at his home at age 63.","https://economictimes.indiatimes.com/news/international/us/dh-peligro-of-dead-kennedys-dies-after-accidental-fall-at-home-says-band/articleshow/95183289.cms","http://economictimes.indiatimes.com/News/rssfeeds/1715249553.cms","IN","general"
"2022-10-30 17:44:35+05:30","1667132075.0","RSS real coffee, BJP just the frothy top: Prashant Kishor","Kishor lamented that it took him long to realise that ""the ideology of (Nathuram) Godse can be defeated only by reviving Gandhi's Congress"" and ""it would have been better had I worked in that direction instead of helping people like Nitish Kumar and Jagan Mohan Reddy realise their ambitions"".","https://economictimes.indiatimes.com/news/politics-and-nation/rss-real-coffee-bjp-just-the-frothy-top-prashant-kishor/articleshow/95183070.cms","http://economictimes.indiatimes.com/News/rssfeeds/1715249553.cms","IN","general"
"2022-10-30 17:43:36+05:30","1667132016.0","BJP trying to buy 20-30 TRS MLAs, topple government, alleges Telangana CM","Telangana Chief Minister K Chandrasekhar Rao on Sunday alleged that the BJP was trying to 'buy' 20 or 30 MLAs of the ruling TRS and topple his government.","https://economictimes.indiatimes.com/news/politics-and-nation/bjp-trying-to-buy-20-30-trs-mlas-topple-government-alleges-telangana-cm/articleshow/95183054.cms","http://economictimes.indiatimes.com/News/rssfeeds/1715249553.cms","IN","general"
"2022-10-30 17:43:25+05:30","1667132005.0","Telangana withdraws general consent to CBI","According to a state government order issued on August 30, its prior consent is required for the central probe agency on a case-to-case basis to carry out investigation in Telangana.","https://economictimes.indiatimes.com/news/india/telangana-withdraws-general-consent-to-cbi/articleshow/95183050.cms","http://economictimes.indiatimes.com/News/rssfeeds/1715249553.cms","IN","general"
"2022-10-30 17:41:05+05:30","1667131865.0","India must advocate own narrative in global discourse: Experts","Dr. Arvind Gupta, former Dy NSA and Dir. Vivekananda Foundation, in his keynote address, discussed the concept of “vishwaguru” and suggested how India can attain this position by making effective use of its rich culture, traditions, and intellectual heritage.","https://economictimes.indiatimes.com/news/india/india-must-advocate-own-narrative-in-global-discourse-experts/articleshow/95182984.cms","http://economictimes.indiatimes.com/News/rssfeeds/1715249553.cms","IN","general"
"2022-10-30 17:37:45+05:30","1667131665.0","COVID India news: 1,604 new cases reported in last 24 hours; active caseload stands at 18,317","","https://economictimes.indiatimes.com/news/india/covid-india-news-1604-new-cases-reported-in-last-24-hours-active-caseload-stands-at-18317/videoshow/95182944.cms","http://economictimes.indiatimes.com/News/rssfeeds/1715249553.cms","IN","general"
